sentenca,ambiente,bebida,comida,geral,localização,outros,preço,serviço
"ótimo lugar para confraternizar com os amigo , jantar com a família .",0,0,0,1,0,0,0,0
ambient muito bonito e a comida é excelent .,1,0,1,0,0,0,0,0
"péssima atendimento da dona do local uma pessoa mau educada não te diz nem boa noit , funcionário nota 10 mai educado que a dona que só sabe da atenção p blogueiro qnd está lá ... pessoa que vive de cara fechada , já não vou mai lá ... sabe nem conversa com funcionário briga na frent do client desnecessário isso mai respeito e educação ... não recomendo !",0,0,0,0,0,0,0,1
"lugar maravilhoso , ambient bom para reunião com amigo , tomar um chop sujo bom demai é pizza gostoso .",1,1,1,1,0,0,0,0
"situado num do melhor shop de manau , o coco bambu é um restaurant de alto padrão .",0,0,0,1,1,0,0,0
o ambient é muito agradável e a vista bonita .,1,0,0,0,0,0,0,0
"ambient muito bom , peix delicioso , atendimento diferenciado e com uma visão bem region .",1,0,1,0,0,0,0,1
excelent restaurant !,0,0,0,1,0,0,0,0
lugar agradavel bom atendimento,0,0,0,1,0,0,0,1
"gostei muito , ambient super ventilado , comida deliciosa , boa música , atendent super educado",1,0,1,0,0,0,0,1
"como alerta , quando a casa está cheia , forma-s fila do lado de fora para aguardar disponibilidad de mesa , ademai , uma ótima opção !",0,0,0,1,0,0,0,0
muiti legal e acongecant,0,0,0,0,0,1,0,0
"a comida é de qualidad , preço justo e sempr encontramo variedad no buffet .",0,0,1,0,0,0,1,0
"o lugar é muito barulhento , muita gritaria de criança devido o parquinho que tem dentro do restaurant , pra mim o único defeito .",1,0,0,0,0,0,0,0
pode ser pra happi hour quanto para dançar até tard .,0,0,0,0,0,1,0,0
"ambient agradável , prato delicioso .",1,0,1,0,0,0,0,0
a melhor pizza com nível italianissimo e percebe-s que utilizam bon produto .,0,0,1,0,0,0,0,0
"varia opçõ de churrasco , comida boa , ambient agradável e familiar , tem área para criança ( pequena , mai tem )",1,0,1,0,0,0,0,0
ótimo lugar para os amant de peix e culinária region .,0,0,1,0,0,0,0,0
"amei mto , a carn de sol é inesquecível , e o atendimento maravilhoso , mto obg bom prato",0,0,1,0,0,0,0,1
a comida e espetacular e a carta de vinho contém rótulo agradávei,0,1,1,0,0,0,0,0
"lugar sempr impecável , comida bem feita , preço justo , clima agradável e atendimento 10",1,0,1,1,0,0,1,1
"funcionáro antecioso , especialment a funcionária belém .",0,0,0,0,0,0,0,1
"lugar é muito limpo , organizado , música boa , atend as norma ambientai e o atendimento foi excelent além de possui ótimo ambient para foto .",1,0,1,0,0,0,0,1
fiz a reserva pelo site e foi super tranquilo .,0,0,0,0,0,0,0,1
ambient aconchegant .,1,0,0,0,0,0,0,0
"excelent localização , cardápio region maravilhoso e um ótimo atendimento !",0,0,1,0,1,0,0,1
experiência maravilhosa .,0,0,0,1,0,0,0,0
